{
  "clipId": "clip_7da3bf60cd103566f355e7b6048c7f26c4ca5f7f1450e70b31c3d08c8fa97f83",
  "projectId": "motion",
  "editVersion": "edit/draft-v2",
  "segmentIndex": 2,
  "shotId": "GAP1",
  "status": "rendered",
  "evidence": "saved-frame-edit",
  "range": {
    "unit": "frames",
    "start": 0,
    "length": 6,
    "fps": 30
  },
  "timelineStartFrame": 219,
  "outputSha256": "fbb750128a1c4f30634d85366bad80f100396d2bb59fc1d698131c33a0e33637",
  "schemaVersion": 1,
  "id": "use_5dfed919a8db2c1d6f03341f62630572219ba0dffd92a40930e67468277323f5"
}
