{
  "clipId": "clip_a2362023f180b407f67657bedab723d1b3b25a1615ed899f05d812bbd7b12664",
  "projectId": "coming-attractions",
  "editVersion": "edit/v6",
  "segmentIndex": 19,
  "shotId": "C4b",
  "status": "rendered",
  "evidence": "saved-frame-edit",
  "range": {
    "unit": "frames",
    "start": 62,
    "length": 21,
    "fps": 24
  },
  "timelineStartFrame": 954,
  "outputSha256": "ae4b58d5c302b3418d4a7c541f62984e73729f345e5f60da6d5189d058b1ae38",
  "schemaVersion": 1,
  "id": "use_dc7a20bb74849550d7d2760b68f51ba8d0e6e4bdc26a3c6dbd8f8ec8c9dd9337"
}
