{
  "clipId": "clip_c1c134704ae3a1d0d938916268423db6ea87d298494decb66f9f66105a375454",
  "projectId": "walla",
  "editVersion": "edit/v4.pre",
  "segmentIndex": 5,
  "shotId": "S06C",
  "status": "planned",
  "evidence": "saved-frame-edit",
  "range": {
    "unit": "frames",
    "start": 0,
    "length": 180,
    "fps": 24
  },
  "timelineStartFrame": 425,
  "outputSha256": null,
  "schemaVersion": 1,
  "id": "use_0f1ce6e0f227d7c3aadb207e13aa86f5d8596ec04c2e2544829f6abc8ad226fc"
}
