{
  "clipId": "clip_2e29db943f63a879197be6b704f100693eafb962152d261e09a22a4789ced723",
  "projectId": "balcony",
  "editVersion": "edit/v2",
  "segmentIndex": 0,
  "shotId": "FL1",
  "status": "rendered",
  "evidence": "saved-frame-edit",
  "range": {
    "unit": "frames",
    "start": 0,
    "length": 116,
    "fps": 24
  },
  "timelineStartFrame": 0,
  "outputSha256": "0e7fec645507d0d4691606a87ce5d99ab7084f52138e088712444ccc48dcd508",
  "schemaVersion": 1,
  "id": "use_8b4f7413539938e17e9410eab7bdcdff9bdcffeace74ece37f7badbbce31aa67"
}
