{
  "clipId": "clip_c8fe277053fbd57d24b2619671029d3146c10ec017dc68a1e839895aef968e64",
  "projectId": "october",
  "editVersion": "edit/v2",
  "segmentIndex": 17,
  "shotId": "V07",
  "status": "planned",
  "evidence": "saved-frame-edit",
  "range": {
    "unit": "frames",
    "start": 24,
    "length": 60,
    "fps": 24
  },
  "timelineStartFrame": 674,
  "outputSha256": null,
  "schemaVersion": 1,
  "id": "use_51346f427e6813423179ebeb27eaa1077e6a58d7c72dbc56f09b99f48f26c05d"
}
