{
  "clipId": "clip_ae0bf733214206d64edbc08bb41a3eb62247f79ce553f3f5599f5b6a72103145",
  "projectId": "october",
  "editVersion": "edit/v4.pre",
  "segmentIndex": 23,
  "shotId": "V13a",
  "status": "planned",
  "evidence": "saved-frame-edit",
  "range": {
    "unit": "frames",
    "start": 0,
    "length": 28,
    "fps": 24
  },
  "timelineStartFrame": 1012,
  "outputSha256": null,
  "schemaVersion": 1,
  "id": "use_3b1415a888db301a1b030123edfcec9e201984c8cb004ec2fb5271f765910461"
}
