{
  "clipId": "clip_4d7127435fc4ebb1c4ba8b2de72612d9971a6aa9f85c77c5f2313bf5592cfab2",
  "projectId": "balcony",
  "editVersion": "edit/v4",
  "segmentIndex": 4,
  "shotId": "S04",
  "status": "rendered",
  "evidence": "saved-frame-edit",
  "range": {
    "unit": "frames",
    "start": 12,
    "length": 128,
    "fps": 24
  },
  "timelineStartFrame": 516,
  "outputSha256": "cccff15e2d72eb0c9f6bcc3fbc074bd2310161985ffb18f25d1c807fdec56774",
  "schemaVersion": 1,
  "id": "use_dba5978034573da1a800b1408f4491990b81f84fe554192366543549d8a7ed6b"
}
