{
  "clipId": "clip_6379965cb8c833e2b1b35a43c4335972398b254db47fa8f783edff67a17ca6c3",
  "projectId": "october",
  "editVersion": "edit/v2",
  "segmentIndex": 15,
  "shotId": "F04",
  "status": "planned",
  "evidence": "saved-frame-edit",
  "range": {
    "unit": "frames",
    "start": 0,
    "length": 14,
    "fps": 24
  },
  "timelineStartFrame": 636,
  "outputSha256": null,
  "schemaVersion": 1,
  "id": "use_bc1f348c309edbef8aa5e5e50a7a49855572fed2483da199da4e646b410a530b"
}
