{
  "clipId": "clip_d3e89edeedc9db40f1c4a4f59958574ad85ed4904f247a02d9fa65f384bf35ab",
  "projectId": "perpetual-check",
  "editVersion": "edit/v1",
  "segmentIndex": 6,
  "shotId": "S07",
  "status": "rendered",
  "evidence": "saved-frame-edit",
  "range": {
    "unit": "frames",
    "start": 0,
    "length": 120,
    "fps": 24
  },
  "timelineStartFrame": 480,
  "outputSha256": "4206e62cbf3590c3e1b22cf4492991d401c96d41e772ddd9568f069008e0036b",
  "schemaVersion": 1,
  "id": "use_d88ffc41c6c0b8f7495b748232155341df2bddaea5c0173504ead9228c4dabc4"
}
