{
  "clipId": "clip_556ef71cc6b187054dacf75e223e6694dfff68db41237cdb60a44e7cc37f62f6",
  "projectId": "october",
  "editVersion": "edit/v2.pre",
  "segmentIndex": 12,
  "shotId": "F03",
  "status": "planned",
  "evidence": "saved-frame-edit",
  "range": {
    "unit": "frames",
    "start": 0,
    "length": 14,
    "fps": 24
  },
  "timelineStartFrame": 544,
  "outputSha256": null,
  "schemaVersion": 1,
  "id": "use_608675928f8e5d98f59d7d4b40cd8f4cfd1043fe22c36fb511bd443b8f2ab43e"
}
