{
  "clipId": "clip_3543d11436d3cd31532842dd7be09465c7be3c8c597920cc43eb04374ae68b18",
  "projectId": "coming-attractions",
  "editVersion": "edit/v5",
  "segmentIndex": 12,
  "shotId": "S05",
  "status": "rendered",
  "evidence": "saved-frame-edit",
  "range": {
    "unit": "frames",
    "start": 0,
    "length": 58,
    "fps": 24
  },
  "timelineStartFrame": 650,
  "outputSha256": "ae2664c6c04d9bf26620c9c83c6988005830ba401c2b1ea945d214478211e22a",
  "schemaVersion": 1,
  "id": "use_2f10bcdd660f97108b570ba77143a91aef32232d8f614978670088173d85f040"
}
