{
  "clipId": "clip_84bfbae1103748366dff6fdc8f11ccfc78cdb088ebcd9578cf5b23169e703406",
  "projectId": "coming-attractions",
  "editVersion": "edit/v8",
  "segmentIndex": 7,
  "shotId": "C2",
  "status": "rendered",
  "evidence": "saved-frame-edit",
  "range": {
    "unit": "frames",
    "start": 0,
    "length": 20,
    "fps": 24
  },
  "timelineStartFrame": 321,
  "outputSha256": "4961d4a66f6f3ac1b10c6157772705c10d90fa86841f12e20e083b0220f8ba46",
  "schemaVersion": 1,
  "id": "use_e96a94fc3d2dda1e8e64ce5ddcc4a5ff37e3ff0e712b4c8aae6650a1e150484d"
}
