{
  "clipId": "clip_85cdbe0a6ae1840fdf5608aba25514e4d80a9f8b8d58da651cbbcebd88afcee8",
  "projectId": "one-unit-apart",
  "editVersion": "edit/v3",
  "segmentIndex": 3,
  "shotId": "S04",
  "status": "rendered",
  "evidence": "saved-frame-edit",
  "range": {
    "unit": "frames",
    "start": 0,
    "length": 360,
    "fps": 30
  },
  "timelineStartFrame": 720,
  "outputSha256": "2bc29a44c6c56942e7e4f4ba666aced212c341c70d473376556b0d02a95d04bb",
  "schemaVersion": 1,
  "id": "use_b44ec8ceb4025fe5e4b4457f7aeb3aae146b43d3c227603d564f9f906e5c7efc"
}
