{
  "clipId": "clip_919ee407265d5afdaf3bdb4d6f38b1cd3284f5a74f1b9f55f80159adac3878ff",
  "projectId": "october",
  "editVersion": "edit/v2.pre",
  "segmentIndex": 16,
  "shotId": "V09-B4",
  "status": "planned",
  "evidence": "saved-frame-edit",
  "range": {
    "unit": "frames",
    "start": 0,
    "length": 24,
    "fps": 24
  },
  "timelineStartFrame": 650,
  "outputSha256": null,
  "schemaVersion": 1,
  "id": "use_732623bd1254a628b953e2568324884016e0a6124ac26c8c78c3cc0488054ac6"
}
