{
  "clipId": "clip_ba729e45b0ae7f984551b5a2b75491703aa13566de8e379aadaa17402c467028",
  "projectId": "october",
  "editVersion": "edit/v2.pre",
  "segmentIndex": 21,
  "shotId": "V10B",
  "status": "planned",
  "evidence": "saved-frame-edit",
  "range": {
    "unit": "frames",
    "start": 24,
    "length": 48,
    "fps": 24
  },
  "timelineStartFrame": 904,
  "outputSha256": null,
  "schemaVersion": 1,
  "id": "use_f3d1aa7ab3707dd22ac71016be9b8d181ff24618495baf29680b76309bcea94e"
}
