{
  "clipId": "clip_677bdd264741674037cb6bb73593d0e951c03f78d302081ac299e3e8db0228e6",
  "projectId": "borrowed-light-fable",
  "editVersion": "edit/v1",
  "segmentIndex": 1,
  "shotId": "S02",
  "status": "planned",
  "evidence": "saved-frame-edit",
  "range": {
    "unit": "frames",
    "start": 14,
    "length": 156,
    "fps": 24
  },
  "timelineStartFrame": 80,
  "outputSha256": null,
  "schemaVersion": 1,
  "id": "use_f57aca7528b3d6592165d527b18ef98908ec8261f6b40441d1d989ac5a094915"
}
